Date,Reviews,Username,Stars,Helpful
4-Aug-18,"Trying to do too much. Every time I turn around, the program is asking me if I want directions home. How can I shut This off. Now the latest version won't stay on a site that I have entered. Instead it returns to a map of my present location. Bringg back the version from 2 years ago. The entire ...
Full Review",John T. Hayner,Rated 1 stars out of five stars,270
3-Aug-18,"The latest update allows you to not only share your location with contacts and vice versa but now you can also view and share the phones battery life... No more wondering if the phone died... You'll know if they're being sly and turning it off while it still had power left or if it legitimately ...
Full Review",Kaelin Slape,Rated 5 stars out of five stars,76
7-Aug-18,"In the past I've had Garmin, Navman and TomTom satnavs. This app is the best I've and it was already in my pocket. I won't buy a stand alone satnav again. A half decent phone is essential for it to work properly but you don't need the most expensive handset in the world. It runs fine on my Moto ...
Full Review",paul herrett,Rated 5 stars out of five stars,1
7-Aug-18,"Please add options for people to be able to find their cars easier. I see the mark my parking function. but hopefully you can build off of that. like automatically saving your parking location depending to what Bluetooth device you're connected to. Even though the parking feature is available it...
Full Review",A Google user,Rated 4 stars out of five stars,68
6-Aug-18,"I have seceral other apps on my phone, including other maps app and everything runs smoothly except for Google Maps. I didn't give it any permission since I just want maps and directions between two points. The app is stuck showing and hiding a small permission request dialog which I cannot sele...
Full Review",Marcelo de Moraes Leite,Rated 2 stars out of five stars,12
2-Aug-18,"For more than two years, if I use GPS, then turn it off to save battery, the next time I use Maps, it *always* gives a popup asking me if I want to turn GPS on. I just want to look up addresses, and very rarely use GPS with Maps. If I need GPS, I'll turn it on. Why does this app throw a popup in ...
Full Review",J Doxie,Rated 2 stars out of five stars,64
2-Aug-18,"This app was very good last year. But as a driver, it's getting crazy making you push too many buttons to start a trip. I don't want to explore. I want to get to an address. I wish I could remove some of those useless features. And every time I start a trip I am going the wrong way. Sometimes th...
Full Review",chimesickle,Rated 3 stars out of five stars,50
3-Aug-18,"The routing will consistently take you a slower way every time, taking random rurns that make no sense. Update: this app has gotten even more garbage, it is worthless to me and ends up taking more time than anything. Download Waze and stop supporting the monopoly that is Google.",Galen McCarty,Rated 1 stars out of five stars,40
31-Jul-18,"When I select Directions on a location, the app no longer automatically sets my current location as the Starting Point, please fix this. + Timeline has been so inaccurate for the past few months that I keep having to manually edit the days events. + Please allow ""Explore City"" to be turned off. ...
Full Review",A Google user,Rated 3 stars out of five stars,242
6-Aug-18,"Again after using it, found nothing great. You have added real time location sharing feature which is Cool but its not usable to send location of any other places which we recommend to other people. Again saying plz add GMAP account functionality using Gmail to send any location to Gmap Account ...
Full Review",predi damor,Rated 4 stars out of five stars,5
6-Aug-18,"1. I was taking a long trip and it suggested alternative routes that would take me 5 more hours to get to my destination 2. When it's connected to bluetooth, maps pauses my music and plays the voice over my phone speakers, not through bluetooth 3. The directions using landmarks instead of street ...
Full Review",Vialle M,Rated 1 stars out of five stars,3
5-Aug-18,"Please add a search option for my contributions. When i ignore a suggested photo addition to one of my reviews please don't show it again. I would have multiple dups of the same photos due to google suggesting i add it then have to delete it after it had numerous views. Im missing credit for qui...
Full Review",Addalyn Brooks,Rated 3 stars out of five stars,6
2-Aug-18,"I use it regularly and within city limits i feel its good. But whenever I have used it to travel to some different city where I don't know the way, it has landed me in thrilling conditions wondering what to do now. Recently, I was going to navi mumbai from pune and used a pin sent by my friend. ...
Full Review",Awanish Golwara,Rated 5 stars out of five stars,29
6-Aug-18,"This Samsung 7 is sctually my Sanchos blancoboyKris. But it works so well I jacked him again. Originally he bought that 7 on T-Mobile but then I change all the account info with Angia (yay) and then we don't give the phones back or anything just slang more. But it'ds cool those Samsung's and Jua...
Full Review",A Google user,Rated 5 stars out of five stars,6
31-Jul-18,"If I want to go to a park, take me to the enterance, not some random person's house that happens to live on the exact oppisite of where I wanted to go. The system sucks all over the west coast. Its only 2 because its only slightly accurate",Jamie Blackburn,Rated 2 stars out of five stars,66
2-Aug-18,"Use it solely. Very good app except few wrong apparently fast routes or on-route-incident. Very often fastest routes are slightly faster, let's say 3-4 min. But in reality it doesn't make a huge difference. Reported On-route incidents are mostly false, because I can see when I arrive close to sp...
Full Review",Suki G,Rated 5 stars out of five stars,23
7-Aug-18,The best app Google has ever made and one of the best apps if not the best of all time. The most recent updates though have caused it to take up too much processing power. My pixel 2 phone is extremely slow when navigating.,A Google user,Rated 4 stars out of five stars,
6-Aug-18,Constantly taking me through neighborhoods with stops and speed bumps. Maps thinks it's the shortest way but doesn't understand neighborhoods are 15mph with turns and stops. This had happened in multiple states. Now I only use maps to look at the map and determine my own route.,Kathryn Stryker,Rated 1 stars out of five stars,24
4-Aug-18,Why this app needs to ask my location all the time? I want to block it forever but then it keeps trying to ask anyway and the app becomes very slow to use. All I need in this app doesn't require my location so there is no need to give it. You should respect that,A Google user,Rated 1 stars out of five stars,8
5-Aug-18,"People are going to get lost using this app. First of all sometimes the navigation doesn't start giving directions when you start to move. I couldn't tell if I was starting in the right direction, I gotten lucky a few times. Then the app has you taking turns when there was no need to. For a rest...
Full Review",Donadrian Smith,Rated 2 stars out of five stars,10
31-Jul-18,"This app has been too slow to try and use anymore and it's frustrating to have to use my PC to search business hours and to find a location. This isn't a new issue either, it's been this way on both my Samsung Galaxy S7 & S7 Edge for the past 6 months.",Purple Fox,Rated 1 stars out of five stars,27
7-Aug-18,"This app is soooo slow. It's not slow due to connection problems, it's not slow like that. I tried to hit recenter over and over the other day and it refused to. A navigation app shouldn't do that. I shouldn't have to divert my attention from the road, trying to get the app to work. It used to wo...
Full Review",Bernadette Jaminet,Rated 1 stars out of five stars,1
6-Aug-18,"Absolutely awful. It changes your route mid drive so you don't notice which is just a nasty thing to do, it's like this app is run by a bunch of 14 year olds messing with people. In no way is this good for getting you to your destination, if you want to see half the city and take double the time ...
Full Review",Adam Wells,Rated 1 stars out of five stars,2
4-Aug-18,I am a visually impaired person. I live in Montreal.I bought S9+ recently. My google maps voice is not working properly. I use LTE plus network. I can't travel properly. It's been going on for 3 months. I used to use S7 and faced a similar problem in Montreal.Please send me a feedback,mohammadd .islam,Rated 2 stars out of five stars,13
1-Aug-18,"App won't work unless location is turned on. If I'm currently at point A, but need to figure out how to get from point D to E next week, why u gotta know where I am right now??",A Google user,Rated 1 stars out of five stars,21
6-Aug-18,I Have Changed two places Names and google team mails me to update my data... in the next 24Hrs. But no response on Maps... i reallly hate it... bcz it always showing the bad information instead i have provided the place right information... then why?,A Google user,Rated 1 stars out of five stars,3
3-Aug-18,Always use Google maps on holiday. I'm a tour guide take pictures every were I go & do review's to help other people. Used it when I got lost in wood this week So it can help.,dean morris,Rated 5 stars out of five stars,9
6-Aug-18,"Tracking visited locations for the timeline is unreliable. Sometimes my timeline says I never left home when I've actually already been all around town. And when it DOES track my location, it's not accurate.",Ria Marifosque,Rated 3 stars out of five stars,3
1-Aug-18,"I've enjoyed using this app for many years but today was awful. Maps was going to be a hero because I forgot my normal route to work was closed for construction and it moves me around it. However it tried to route me through streets that were closed due to flooding, and I have no way to tell it ...
Full Review",andy jefferson,Rated 2 stars out of five stars,22
6-Aug-18,"This app needs more improvements,it has took me wrong places and tells me very late at turning points. Please improve this app. Most of the times it takes to the longest way.it should have shorter routes also.",Tasneem Azhar,Rated 2 stars out of five stars,5
3-Aug-18,"Latest update is not good as in navigation dot to arrow response time increased, even arrow location is lagging on map. In custom under service please add CNG gas stations, or let us allow to to add custom access to our likes",Rushikesh Jani,Rated 4 stars out of five stars,22
6-Aug-18,"Incapable of recognising my home address. Consistently insists my home is on another continent. Google have failed to respond to requests to fix the flaw, indeed they won't even acknowledge the problem. If it can't get my address right, how can we know other addresses are right? Well, actually t...
Full Review",A Google user,Rated 1 stars out of five stars,
3-Aug-18,Google messed this app. I can't see the distance in map. For this I have to click Direction. Disgusting. If you give a place name it shows the time to reach by car. But not distance...why some shud click direction to know just the distance,Sunil Kumar,Rated 2 stars out of five stars,9
3-Aug-18,App is working great. Thanks. The world is proud of Google Engineers. The only thing I think is that a Speedometer should also be added as many other apps are doing that separately. Thus it would demolish our desire to use them.,Nirbhay Pandey,Rated 5 stars out of five stars,12
6-Aug-18,Google maps app takes a few to open when tapped. Hangs up sometimes. It takes forever to load the maps after getting in too. Map itself is good after everything is loaded but they need to make the experience better and faster.,Vu D,Rated 1 stars out of five stars,6
6-Aug-18,Make me lost in nowhere. Keep saying signal lost but the signal is good. Worst google app for navigation. Not even helpful when you lost somewhere and not accurate enough when there is many route at the location,AHMAD FIDZRY SADRUDDIN,Rated 1 stars out of five stars,2
4-Aug-18,"The maps look so good on the screen but when you try to use it, the accuracy is terrible. I don't want to play toy for the children - I need a map that's based in reality. Google should be ashamed to support this product.",Jack Wiggins,Rated 1 stars out of five stars,367
1-Aug-18,New update doesnt allow you to close app once you arrive. Stays on in background and icon at top of screen doesn't go away. You have to force stop the app to make go away. Only started doing this yesterday once app was updated. Fix and then it's a 5 star app again.,Peter Orszagh,Rated 2 stars out of five stars,21
4-Aug-18,"I earlier used to love this app however since few days, it takes forever to find the best route. After the destination is entered it takes so long and most of the times fails to generate a route. I request google to look into this matter.",Abhishek Singhal,Rated 1 stars out of five stars,8
6-Aug-18,My number one app. No complaints other than I wish the map would zoom in a bit closer when negotiating intricate roads particularly roundabouts. Have missed junctions because I couldn't see the exit clearly enough.,Peter Crosswell,Rated 5 stars out of five stars,5
1-Aug-18,"In night mode fonts should be bigger. Would be nice to switch navigation into the drive only mode which is much bigger and its clear. What about ability to report accident or road shut? Its nice to report that road is already open. An option to press a button and see where you have obstacles on ...
Full Review",Andy Zu,Rated 4 stars out of five stars,20
7-Aug-18,"I have to close everything for just make the app barely useful. The lag is incredibly annoying Usually lose gps connection I doesnt give the direction where the car is going, just a dot that barely moves",Ankaferm,Rated 1 stars out of five stars,2
7-Aug-18,"Google maps is now a must have! Though I think it still falls short of perfect, being able to save locations is very handy but all you have is a star or heart icon then it comes down to muscle memory whereas being able to attach a short note of description for your own use, would really make thi...
Full Review",mark Vincent,Rated 4 stars out of five stars,4
3-Aug-18,"Google, get your act together. All of a sudden, the most important part (saving places, adding to lists, etc) broke. I'm trying to plan for a trip, but I cant because I always get the ""cant connect"" error. However I'm connected to wifi and data and I updated the app (which I now regret).",Richard Lu,Rated 1 stars out of five stars,6
3-Aug-18,"I used to love this app but lately it has been super slow. I wish developers would stop making updates that just make apps worse. If it's not broke, don't fix it.",Jill Moore,Rated 3 stars out of five stars,9
6-Aug-18,Google map is really good... But my concern is why you guys given the bus timing because its useless... They are still not in time... Do updates or remove that upadates,Jaya chinnu,Rated 5 stars out of five stars,3
2-Aug-18,OMG this app is now painfully slow! Was this tested only on high end mobile devices? It's the slowest app on my Motorola G4 phone. What happened?,Michael Behan,Rated 1 stars out of five stars,16
4-Aug-18,"Good app, takes you to your destination at the best possible time. However, sometimes alternate routes are not so accurate. Once we start moving in the known route, it reroutes and shows that you can reach in lesser time.",Nandakumar Pachikide,Rated 5 stars out of five stars,2
6-Aug-18,"Google Maps is constantly putting me in the Wrong place. I have to correct them all the time. I don't live in the Street Out In FRONT OF MY APARTMENT! I am Disabled, Elderly, and in a Wheelchair.,. NOT Nice of you GOOGLE.",A Google user,Rated 3 stars out of five stars,3
1-Aug-18,"Though this app regularly get me to where I want to, our trip to Vancouver was a whole other story. Twice it sent us on obscure out of the way routes. Luckily my wife's Maps app had figured the correct way to go before I lost my sanity. Same app, different directions... Neato.",Billy Devlin,Rated 1 stars out of five stars,16
5-Aug-18,"Keep getting error message ""can't connect."" I'm clearly connected to the internet and it's acting like I'm in offline mode. Need this fixed immediately!!!!",Brandon Elkert,Rated 5 stars out of five stars,15
1-Aug-18,This thing is taking forever to find routes and previously the app worked fine. Get this fixed google not expected this from you. Seeing how far is the place from my location is like I have to wait for the time in which I can book a cab. What is going on with you guys. Totally disappointed.,Kunal sharma,Rated 3 stars out of five stars,7
2-Aug-18,Suddenly I just can't check the details of every place. It keeps saying I'm offline when I'm not. Other network functions are fine. I can search or check my lists. So annoying please fix this thanks a lot!,,Rated 1 stars out of five stars,7
3-Aug-18,A five star rating would have been given until the recent updates to the app. Navigation is off on selected destinations and why are there pop up ads when driving??? Want a better rating... fix your apps and get rid of the pop ups.,James Siders,Rated 4 stars out of five stars,3
1-Aug-18,There needs to be a pause button so you can go into a services without it trying to reroute you. The X needs to move to cancel a trip. Soo many trips end because I've accidentally pushed it before I've reached my destination,Chris Seager,Rated 4 stars out of five stars,4
4-Aug-18,So laggy lately and ends up freezing my whole phone. Crashes so much lately. I ahte all the new updates they keep making the app worse and worse.,Neha Jani,Rated 1 stars out of five stars,3
2-Aug-18,"Every time I start the navigation, the current location jumps to a random location. Completely unusable... (I've tried to clear data, install again and even with a different Google account)",R. Tourian,Rated 1 stars out of five stars,4
1-Aug-18,"Used to be an app I used daily, now it cannot find a route to anywhere. That was the main use for it and now it's easier to walk to my car and boot up the sat-nav.",A Google user,Rated 1 stars out of five stars,28
31-Jul-18,It's a great app. Use it all the time. But the maps on alot of the places where I go are close to a decade out of date on street view.,Steven Page,Rated 3 stars out of five stars,19
2-Aug-18,"It was brilliant until yesterday's update! Now the directions are all over the place, particularly when using multi-destinations. Please fix then 5 stars again!",Sal Monella,Rated 3 stars out of five stars,10
4-Aug-18,It has missed two road closers for me in the past two days. Is there a problem? It used to know about one of them.,Julia Ray,Rated 1 stars out of five stars,2
1-Aug-18,"Works great! One exception. Won't keep recent or for that matter, any past locations. Must continually re-enter addresses. Needs some kind of bookmark feature! ",ottawahomepainting com Henry Harter,Rated 5 stars out of five stars,14
1-Aug-18,"The best sat nav for the UK, the reroute feature has saved me many times from serious congestion. The timeline function is also fun to see where you have been",The Occasional Comment,Rated 5 stars out of five stars,9
5-Aug-18,No delete Features on Share Location. When someone deactivate their share location profile. it's just hanging there with grey color. You can do better Google,Marc Sanchez,Rated 3 stars out of five stars,
6-Aug-18,Its weird how every time I use maps it automatically open my camera and take tens of photos without even my permission. I disable its access to my camera but still happen. It never happen when I open other apps. Its really annoying.,Agus Prianto,Rated 3 stars out of five stars,
6-Aug-18,"Horrible annoying new feature when you hit the home button it doesn't minimize the app it makes it smaller no matter how many times I hit the home button I still have to go click the little window off!!!!! Horrible!!!! If I can turn it off I'll give 5 stars. This is the only reason for 1 star be...
Full Review",Charles Day,Rated 1 stars out of five stars,
3-Aug-18,"GPS of my location is off by about 3 miles. Cannot get my home address and location correct. Seems to try and use me as a lab mouse to test out times on outlandish, out of the way routes that take twice as long to get where I'm going. When I don't take the route it wants it keeps trying to rerout...
Full Review",Natalie Church,Rated 2 stars out of five stars,
1-Aug-18,"When it works as it should, it's great with exceptionally clear guidance - both on screen and by voice. But I have two annoying issues. Despite clearing data on and off line and re-entering my home address several times, Google Maps always navigates to a random 'Home' address. Secondly, I'm alwa...
Full Review",A Google user,Rated 3 stars out of five stars,26
2-Aug-18,"Give me an option to disable automatic faster route changes. I pick the routes I want for a reason, but every five minutes it automatically changes my directions. Infuriating.",Scott McKenzie,Rated 1 stars out of five stars,6
31-Jul-18,"I love Maps but I go the same route to work everyday, and everyday Maps tries to take me 5 minutes out of the way making a bunch of U turns...I don't understand why the app hasn't 'learned' the shorter way exists. Drives me nuts",Meghan Simon,Rated 3 stars out of five stars,22
2-Aug-18,"I use this app frequently for directions. I've found it to be very helpful and accurate until today. While driving to a new location in Dallas, the directions told me to go half way around the roundabout. There was no roundabout... only a y with the left fork being a freeway on ramp.",Debbie Bayam Dillon,Rated 4 stars out of five stars,1
3-Aug-18,"Really slooow. I used to love this app. It was one of the reasons I wanted a smart phone. We relied on it often when traveling. It was wonderful. Now it is so slow that it's useless (I tried uninstalling and reinstalling, cleared data and the cache, but that didn't help). It takes forever to open...
Full Review",Sandy Walker,Rated 3 stars out of five stars,
3-Aug-18,"I keep getting ""can't connect"" error message. This app is useless to me right now.",Tiffany Macy,Rated 1 stars out of five stars,5
5-Aug-18,"Use this app often. Pretty useful. But hard to drag the blue line (original route) to other roads. Slow, often direct to the next turn after passing the street.",Jessica Gunawan,Rated 3 stars out of five stars,
6-Aug-18,Use it all the time for work being I travel and it's wonderful.... just wish we could see what the speed limit was on here being some roads don't have a sign for miles. It does it on Apple phones but not android.,Eric Campbell,Rated 1 stars out of five stars,2
2-Aug-18,New update really sucks!!!! Doesn't do anything except show where I was when I started it. No arrow or turn directions now. Am not happy with how it is now. You really need to fix it fast.,A Google user,Rated 1 stars out of five stars,3
1-Aug-18,"This map is so easy to use, but the loading of the maps in Satellite view and the loading of the real-time traffic and the loading of the businesses are really slow. Can you please fix, thanks.",Jack Wolf,Rated 4 stars out of five stars,5
1-Aug-18,"I try to quickly check public transportation routes to and from work, but Google Maps redirects my ""Work"" shortcut to an Iron Works address every time. It also won't alert me when the route I have chosen has been delayed.",Austin Archinal,Rated 2 stars out of five stars,8
3-Aug-18,Yo it's a great app but now it just says 'can't connect' My WiFi is fine and I can give you proof because otherwise how did I write this review. Well I could of used data but I didn't. Trust me.,A Google user,Rated 4 stars out of five stars,
3-Aug-18,"In new version navigation doesn't tell on what Street you need to turn, and it often can be really confusing. Also it would be much better to get alert after completing turn of where you need to turn next in order to change lanes beforehand.",Yulia Philippova,Rated 2 stars out of five stars,3
1-Aug-18,I've been facing a lot of GPS issues. Doesn't really locate my exact location even though I've got good connectivity. Went to the wrong way may times due to this.,A Google user,Rated 2 stars out of five stars,6
5-Aug-18,"Google Maps is good, however, there are few things that bug me. One example is that a lot of times it presents an exit as a Fork in the road. This makes it confusing when driving as you think that you need to exit off of a highway sooner than you actually do. Another issue is the rate at which ne...
Full Review",Derek Ward,Rated 3 stars out of five stars,
2-Aug-18,It is an lmprovement on the last update. Just to let Google map know that the Dublin Luas light rail line extention still has not been added even though it opened last December apart from the new stops on it.,David Stuart,Rated 3 stars out of five stars,7
2-Aug-18,I would have given it a 4 star but sometimes it says can't connect or something. Hoping in the future for a speedometer and possibly a future to tell us how much the tolls cost Everytime we pass by one,A Google user,Rated 3 stars out of five stars,1
1-Aug-18,what it mean that.. update coming frequently..if there is no need.......bug fix..an at all tym...said that....... means what....just for waste of tym data n pho get slower n slower.... because of RAM gets full of that update,pranjal chavarkar,Rated 2 stars out of five stars,2
4-Aug-18,Recent updates cause this app to freeze. Have to constantly reboot the app until it works. If only Google was a bigger company they could probably easily fix the issue.,C Murphy,Rated 2 stars out of five stars,
6-Aug-18,Great app but restarting often with Android Auto with last couple updates. It's pretty distracting when it happens. Seems the battery saving or memory collection is killing the processes,Nick Hester,Rated 4 stars out of five stars,
