Date,Reviews,Username,Stars,Helpful
19-Jul-18,"Doesn't load correctly, gives incorrect directions or dramatic unnecessary detours, won't work from browser then forces an update to the app, half the time street names won't load until you're well past them. Like in the next city. The app closes itself randomly without notification. Like after ...
Full Review",Elliott Terhune,Rated 1 stars out of five stars,
22-Jul-18,"When you zoom into somewhere in satellite view... It doesn't zoom at all, resolution remains bad. I've tried reinstalling and updating, nothing helps. I only can use the normal view(map) and not satellite",Groveish,Rated 1 stars out of five stars,1
22-Jul-18,What did you all do?? You made this app harder to use. Now i have to put in my location every time I open the app. Garbage.,Willy Sanchez,Rated 2 stars out of five stars,1
31-Jul-18,It tells wrong routes all the time for bike and cars. But shows correct diemension for cab. Wth,Ajinkya Kulkarni,Rated 1 stars out of five stars,
25-Jul-18,Real-time transit updates do not work anymore. Really annoyed.,Daryl Albano,Rated 3 stars out of five stars,
1-Aug-18,I feel Google is using AI to update or ruin an application which was wonderful once upon a time. Totally messy and non-intitutive interface.,info data,Rated 1 stars out of five stars,
30-Jul-18,"All bad gps way off.... I can't do my job because your GPS does not relocate me in the right position nor does it route me to the right location so I can't even use this app to make my deliveries....... I even made a travel somewhere to a zipline and couldn't even find it because the map was not...
Full Review",Zachary Meriweather,Rated 1 stars out of five stars,
30-Jul-18,Googlers still can't fix the lags and freezes. This app gets buggier and slower with each update. I hate using it.,A Google user,Rated 1 stars out of five stars,
28-Jul-18,"Navigation needs many improvements! Uses too much data, offline maps downloaded but offline route calculation is impossible, if navigating abroad - get ready to pay loads of money for roaming, even with offline maps! Search function while navigating is bad as well, no places of interest included...
Full Review",Justas Santaris,Rated 3 stars out of five stars,
24-Jul-18,"Google Maps is a great app to find maps routes filling stations markets shops transit restaurant and much more with quite easy and simple operation.it provide 100% real and quick guide for an unknown place. It helped me a lot to travel in cities even I don't know about them but with the help of ...
Full Review",A Google user,Rated 5 stars out of five stars,
26-Jul-18,"One of the most useful app in history. Found a small bug tho, while sharing a place trough hangouts, can't go back to maps.",Garry Mahendra,Rated 4 stars out of five stars,1
31-Jul-18,Google maps continually changes my routes after I've planned them. Unless I click no constantly. Insane. I'm on a motorcycle. I can't pull over every time it asks me. Stop!,Paul P,Rated 1 stars out of five stars,
6-Aug-18,"Thank you for giving us the quickest route to our destination, but when I click another longer route and ask for navigation to give us directions for that route, dont start giving directions for the route we did not want. We want to drive through the Rockies on our way home, not through Albuquerq...
Full Review",Jen Ahumada,Rated 3 stars out of five stars,
20-Jul-18,"Why are you deleting my feedback? - (you can nrot view locations when you press it on he map when you have directions from a to z on, it works with no directions set thou, > I mean not on the direction steps I mean once u set the directions u can not like click somewhere random to see a - street ...
Full Review",Tom Mersy,Rated 1 stars out of five stars,
28-Jul-18,The bus routes stopped working and I haven't been able to see them at all for PARTA. They worked great until a last update.,Shane Lestan,Rated 4 stars out of five stars,
25-Jul-18,if I confused in location my google map help me more. really it is the best app,A Google user,Rated 5 stars out of five stars,
1-Aug-18,"This map app is terrible! It constantly gives me the wrong directions and sends me on routes that make no sense. The multiple stops feature works fine (edit; I was wrong, it's terrible), so I gave it a two (one)star rating, but if I have to hear the grating voice of the navigation again, it will...
Full Review",Marcus Igarashi,Rated 1 stars out of five stars,
28-Jul-18,"You got to put departure and arrival times for more than just transit but for car and walking and biking and everything. What if people don't want to take a bus because they're going somewhere far and it would take 4 hours on the bus? Let people plan trips using your app for more than just transi...
Full Review",Meghan Nordt,Rated 3 stars out of five stars,
27-Jul-18,"I want to give it a higher rating. But YOU NEED TO GIVE US THE OPTION TO CHOOSE TRUCK ROUTES! you know.... those super large automobiles? They can't be driven on any and all roads. do you have any idea how scary it is if you miss your turn and Google Maps tries to reroute you down a road that you...
Full Review",Lindz Radev,Rated 3 stars out of five stars,
23-Jul-18,It's ok overall but off-line maps don't work at all and it can be quite invasive with notifications,Rgis Gourdel,Rated 3 stars out of five stars,1
22-Jul-18,I opened it after a month and it's not working at all. It's not searching any location of my city and internet service is good and location is also ON with high accuracy.,Haroon Zia,Rated 1 stars out of five stars,1
27-Jul-18,Not sure why but since last update navigation DOES NOT work it will show me the route and my blue dot will NOT move from starting point. If I could uninstall it totally off my phone I would,Criss Wilson,Rated 1 stars out of five stars,1
20-Jul-18,It would be amazing if you had Rivers and other fishing or hunting spots instead of just places to eat and stores ALOT OF PEOPLE LOVE THE OUT DOORS AND A FISHING OR WOODS FINDER WOULD BE AWESOME,Elias Hernandez,Rated 3 stars out of five stars,
27-Jul-18,"Great app for driving, not so great for walking. Have had a few problems.",Praveen Khanna,Rated 3 stars out of five stars,
20-Jul-18,I have a huge problem in navigation it shows me as a dot. Despite that it's a great app!,kristo kp,Rated 4 stars out of five stars,
23-Jul-18,Works well BUT* It's not 100% after our 911 numbers changed. Accuracy is key being that I'm in a rural area. Would be great if the app reflected these address changes from 7+ years ago. Thanks Cody from Texas.,Michael Lock,Rated 4 stars out of five stars,
19-Jul-18,The lastest update made it terrible. For example it's not possible to get directions if the destination is closed. It's a classic developer mistake when he thinks he knows how the app should be used instead of letting the user actually decide.,Adam Klar,Rated 1 stars out of five stars,
31-Jul-18,"Love it, but tired of constantly updating. I wished I knew how to do it just once a month? Any recommendations on this subject would be much appreciated.",Cora Young,Rated 4 stars out of five stars,
23-Jul-18,"Sometime it's not working good, and misguide us. Please do better. Thanks",Momi Gull,Rated 3 stars out of five stars,
24-Jul-18,Took a route from Spokane to Boise. Going there went fine until two blocks before my destination where it told me I had arrived. Coming home it reset back to the going to Boise then reset my route to miss the major city and instead go an hour out of my way thru farm land.,Yvonne Eskins,Rated 2 stars out of five stars,
21-Jul-18,I wanted to reached Mumbai India from Thane India by road ways It showed me long route it took me 2 and half hours to reach and while coming it took 1 and half hour according to my route it always shows me a lone route Please fix this bug Google.,J Tanmay,Rated 4 stars out of five stars,
20-Jul-18,Actually my job delivery Job ...... I don't know customer location properly .... but I ws done crt timely bocoz of always with me dz navigation so I cn delivered very pst before Customer expectations time tk Google map team ....... tq so much,subash boss,Rated 5 stars out of five stars,
27-Jul-18,"I've been using this app for many years and normally I don't have an issue with it but when on my morning commute the maps app sucks 411mb of data in a 45 minute span there is a serious problem that needs to be addressed. This is not the first time either. I thought to myself, well maybe I should...
Full Review",A Google user,Rated 2 stars out of five stars,5
31-Jul-18,"unable to add missing private and govt. places, like as school or sweet shop ect.. fix it 1st",ManDeep SaiNi,Rated 1 stars out of five stars,
28-Jul-18,The app just used my entire 4gb data allowance in under 2 hours. Switched it to WiFi only mode and it couldn't get me home at all! Expected better. Now have to wait all month for more data and will switch to bing maps,A Google user,Rated 1 stars out of five stars,
22-Jul-18,Why would they take GAS STATIONS off explorer page? Now you have to scroll through to find it. Also love how it tells me to go 3 miles down to make a u turn when I'm walking in the store....when it doesn't freeze up that is..,Sonny G,Rated 3 stars out of five stars,
21-Jul-18,The most reliable maps/Navigation app. Add few features in navigation settings like 1) Avoid narrow roads,Amitkumar Gaddikeri,Rated 5 stars out of five stars,
29-Jul-18,I dont know about google maps I was driving in the mountains of Colorado it told me to turn left to get to where I was staying and there was no road just a cliff and it took me a couple stupid way also,inyour fnface,Rated 3 stars out of five stars,
3-Aug-18,"I really wish it didn't try to push me onto a different route 5 times after I keep telling it I am wanting to drive the route I picked. When you're the driver and it automatically tries to push it sometimes you don't notice it's switched routes until you've waisted time, also when I was asleep an...
Full Review",A Google user,Rated 1 stars out of five stars,
25-Jul-18,after your update i can't view my map any more it won't show you the pathor direction it keeps loading forever great plus my gps signals jumping even if i don't move that piss me off... uninstall ing your update right now,Vergil Cruz,Rated 2 stars out of five stars,
20-Jul-18,"Greatest app for navigating, finding restaurants and things to do, even has the very helpful ability to tell you what buses and trains are available. Except Cal train for some reason. It never shows Cal train unless you specifically tell it to start from or go to a station.",Brad Harris,Rated 4 stars out of five stars,
30-Jul-18,Nothing works on the useless thing! Waste of space and time,SICK SPLEEN,Rated 1 stars out of five stars,
23-Jul-18,"Sort of good, but very annoying in some regards. For example, it keeps ""autocorrecting"" addresses to different languages than they were written in (applies to appointments written in Google Calendar too), which makes no sense at all. For example, a meeting between two world leaders that was held thi...
Full Review",Erno Sjgren,Rated 2 stars out of five stars,
19-Jul-18,"my thank go out to the developers for all the time that went n continues to go into this program and for free!! As this is the only way my husband, and i are able to travel,and that's really cool,so many places we thought we'd never see together!! Thanks Hubby & i!",Cimhappy Ploughe,Rated 5 stars out of five stars,
20-Jul-18,"Thank you Google for such and amazing navigation app..! I use this app in my daily everyday driving, walking to direct me via the quickest routes so I can escape trafic and reach my destinations fast and safe with the help of the newly improved tech like live updates..! I love it..! BO$$..!",BOSS BONE,Rated 5 stars out of five stars,
20-Jul-18,This app slows down your phone and takes up way to much space. I travel for a living and used to use it all the time but the new updates have made my phone lag so bad that I had to take it off.,Sara Norton,Rated 1 stars out of five stars,
20-Jul-18,"After an update they added GrubHub and other ads that show up when you select a location (and then takes up the majority of the screen and can not see the map) and it does not allow you to shut it off. It used to just show the location name and rating when you selected a location that just took u...
Full Review",A Google user,Rated 1 stars out of five stars,
23-Jul-18,Have to go thru several prompts before getting to map which doesnt even load the directions that are imput. Most people will use the app as they are driving and this scenario makes it very dangerous,A Google user,Rated 1 stars out of five stars,
30-Jul-18,problem occurred..... can't see my current location automatically.,Saidur Shamim,Rated 5 stars out of five stars,
27-Jul-18,It's just a trash on Android 8. It just hangs up all day long. I am wondering why there is not any update since long time ago !!!,Christ Giorgi,Rated 2 stars out of five stars,
29-Jul-18,Anyone want to tell me why its putting my location all over the place. Says im in Toronto one minute then another city the next.. Keeps going back and forth but not actual location,Tyler McManly,Rated 3 stars out of five stars,
31-Jul-18,The route is not editable. There is a bridge out. I cant correct or drag the blue line. Google maps can not correct it and this app wants me to go down a road thats 45 miles out of my way just to go back to the same road that was 55 the whole time,A Google user,Rated 1 stars out of five stars,
31-Jul-18,Hate maps find to many inaccuracies. Tries to guide me through walls in San Diego maps tried to direct me me to drive down pedestrian pier and continue off pier for 1 1/2 miles out to sea might want to fix that.,A Google user,Rated 2 stars out of five stars,
2-Aug-18,After last update it doznt work like it worked before. No it show wrong route Kindly fix this problem. Regards.,Shafiq Alawi,Rated 1 stars out of five stars,
21-Jul-18,"this app does not work on my phone when I open the app the pointer centers at the middle of the screen and it stays there and theres no means of controlling it . I have to turn the screen off and restart with another app to get rid of the problem. I have tried many times deleting it an reinstalling ...
Full Review",pacefuga,Rated 1 stars out of five stars,
23-Jul-18,Grab ad always on. When i try to set a direction the ad is placed in such a way that buttons at the bottom are obscured so the map is useless. And i can't download offline maps anymore. Used to be this app is my goto map app but because of this issues not anymore.,jimmy pangilinan,Rated 2 stars out of five stars,
5-Aug-18,I would like to share an idea for your future developments. Can you add 'track my way' feature. It means that when we were go to some area with out looking map. Then the map will automatically tracked our root from our destination. It just an idea from my mind.,Vishnu RK Anad,Rated 5 stars out of five stars,
31-Jul-18,                   honor 7x                ,Hadi Zendehdel,Rated 5 stars out of five stars,
20-Jul-18,"This App became hard and it's stuck always plus GPS signal lost always it takes from the battery life too much, please try to solve the problems soon",Belal Deeb,Rated 2 stars out of five stars,
22-Jul-18,"Just once you can set your destination and then it keeps changing it to take you on toll roads and then you change it again and it wants to take you on toll roads are into the city I have a sneaking suspicion i that Google is in with EZ Pass cuz it off seems awful awful peculiar wants to make me...
Full Review",Joe Williams,Rated 1 stars out of five stars,
27-Jul-18,GPS signal never found slow confused in city streets not adaptable to all phone who have URL no improvement after a decade debugging still no improvement,Eugene Curia,Rated 2 stars out of five stars,
23-Jul-18,"You finally stopped asking for my location every time I open the app, thanks!",A Google user,Rated 3 stars out of five stars,1
24-Jul-18,With the latest update installed the app would not open and close every 2 minutes. Tried everything to fix but no luck. Decided to uninstall updates and hey Presto it's back working. Please fix this issue and let me know it's safe to update to the latest,Andy Price,Rated 1 stars out of five stars,
30-Jul-18,Excessively large info when searching maps for places. Don't really need all the pictures and review details of places as it reduces the map view quite a lot. At least allow us to turn the info display off.,Mig N,Rated 2 stars out of five stars,
26-Jul-18,It's the only app on my phone that consistently freezes and stalls out. Garbage.,A Google user,Rated 1 stars out of five stars,
29-Jul-18,The app ok but my question is where is the option we had to avoid toll roads?? It took me to a toll road today and now I have to pay. We had the option to avoid these type of roads but it's not there anymore.,Tony Joker,Rated 3 stars out of five stars,
1-Aug-18,I use this map very often. Very useful especially while driving but sometimes it behaves very weird and starts to show longer routes and even go around the destination round and round that's strange.,A Google user,Rated 3 stars out of five stars,1
23-Jul-18,The app keeps stalling. I've had to force quit it a few times this week.,Theresa O'Donohoe,Rated 2 stars out of five stars,2
19-Jul-18,Great navigational tool to never get lost again works very quick in deciding directions and I am pleased to say that if I do make a wrong turn it quickly works out another way for me to go,Paul Oneil,Rated 4 stars out of five stars,
23-Jul-18,"Latest update has made this app unuseable - complete & utter rubbish google. Sort this utter utter mess you have created out. Still a useless mess Google your coders are useless. Every single proprietary Google app now has massive issues. This app is now useless on smartphones in street view. It...
Full Review",Rob Simpson,Rated 1 stars out of five stars,
30-Jul-18,"the DUMB developer who decided to put the direction button on the left side of the screen recently, should be fired! most drivers use right hand to hold the phone, just think about it.",A Google user,Rated 1 stars out of five stars,
1-Aug-18,Doesn't work efficiently just shows the outline not the exact route totally messed up after the update hatts off to the developer plz sell groundnuts on foot paths,akshay Kumar,Rated 1 stars out of five stars,
26-Jul-18,"Can't find previous driving directions and maps in the timeline. Would also like the option to get maps for strictly rural roads (app avoids interstates good enough, but sometimes would like the option to avoid state highways as well).",frank johnson,Rated 3 stars out of five stars,
22-Jul-18,Its not showing the exact location . Its only showing the network tower location. So please help me to rectify it,Muhammed Hajid Shah,Rated 1 stars out of five stars,1
26-Jul-18,Since the update on the note 8 maps don't have street names when trying to find location,Marcus Conner,Rated 1 stars out of five stars,1
31-Jul-18,"Stupid Google maps keeps tying to take me down a road that has never existed, never. And it also changes my destination to a street named after the suburb . Very annoying.",bryan verrall,Rated 3 stars out of five stars,
28-Jul-18,Senator Chuck grassley blocked me..from giving 1 star opinions. I deleted an account with almost 3million views. F - Google maps... It's a violation of my constitutional right for my senator to block me.,Ruth Turner,Rated 1 stars out of five stars,
20-Jul-18,This app needs some serious updates. Ive almost gotten into car accidents because of this apps problems with lagging or not being able to locate where i am.,Nick hooters,Rated 1 stars out of five stars,
25-Jul-18,"This app caused terrible image retention (aka burn-in) on my Galaxy S8. Disappointed that there isn't a full screen option or OLED friendly option. The ""save 5 minute"" detours are worthless and frustrating. I otherwise like and use this app everyday",Brian Jackson,Rated 2 stars out of five stars,
21-Jul-18,I agree with the other person. I too need this for so long. I think i would have already used this feature daily if it were an option. Matter of fact I nees the last 7 days with full detail. But i guess i will have to just wish in one hand.....,Nowo Really,Rated 2 stars out of five stars,
29-Jul-18,"I can only use the factory-version of this app. If i update it, it can't be centered and the my location doesnt move while in navigations. The background of the map is also plain blank.",Indra Eka Prasetya,Rated 1 stars out of five stars,
25-Jul-18,"Fix your freaking app! I have a avoid toll roads checkef and it keeps trying to use them. I was on an unfamiliar road at night and ended up on a toll road because if this bug. Now, I've got to pay for that. FIX THE F'ING APP!!!",Gene 5133,Rated 2 stars out of five stars,
23-Jul-18,"Asked for directions home from Niagara falls which is only a hour and 15 minutes, and it kept wanting to take me other directions with an estimated time to arrive home about 3 hours later.",tiffany faison,Rated 1 stars out of five stars,
22-Jul-18,"1 star just to draw the attention, post few updates my navigation is not working, the cursor remains stagnant at the starting point of the route, immediate support requested",Suman Kumar Das,Rated 1 stars out of five stars,1
28-Jul-18,"Very slow in giving route, we took left or right before she gave the right direction so we have to search for uturn again to go back from the branch",A Google user,Rated 1 stars out of five stars,
26-Jul-18,It has updated and now loses GPS signal every 5 secs. Freezes and takes over my phone. Can't close or navigate to other apps. Have to restart phone,Rhondy Jr,Rated 1 stars out of five stars,
20-Jul-18,The new update makes it so i cannot start the route. Fix it! I need to go to Mass and your crappy updates ruined the app,Angela Haynes,Rated 1 stars out of five stars,
28-Jul-18,"One of my fav apps, but recently I moved to Cyprus, and now I can't share my location with my family because Google doesn't allow it here. Sad!",Artem Kuroptev,Rated 2 stars out of five stars,
21-Jul-18,"Google bans all its services in some countries, but It asks for your private data to improve its apps whenever it needs, it is disgusting",Mohsen Alizadeh,Rated 1 stars out of five stars,
22-Jul-18,"After the latest update on my LG V30+, the phone will literally hanged when I run this Google Maps!!!!!",Darmawandy Rozali,Rated 1 stars out of five stars,1
22-Jul-18,"Very wrost app Google always depress to local guide, My points are 50800, and I get 9 badges but he decrease 40000 and total badges, I hate google",kandarp Narayan Mandhata,Rated 1 stars out of five stars,
20-Jul-18,"For the first time ever I thought my phone was frozen.... The little popup map that opens in the bottom right corner (poor placement too) is a nuisance and there's no way to turn it off. Google maps used to rule but now I need a new app for navigation, since this update. Way too buggy and resour...
Full Review",Brendan Wallace,Rated 1 stars out of five stars,
26-Jul-18,Only shows a single route when you tap on transit directions. Before it used to show multiple routes. Each update always break things. Why can't you be consistent?,Vic Tan,Rated 2 stars out of five stars,
29-Jul-18,Maps always fails to load when using 4g. I tried clearing all caches and data. But still doesn't work. Also tried deleting and re installing the app. Please fix this,Adeline Xie,Rated 1 stars out of five stars,
30-Jul-18,"They do not care, but it's decently fast and responsive that's why I use it. Worst than ever, removed convenient shortcuts.",Tobias,Rated 1 stars out of five stars,
31-Jul-18,"I did have a bad experience that I would like to share though. On a recent trip from West Palm Beach to Miami, it gave me specific lanes to be in on 95 S. At one point it told me to get in the far left lane. I thought the road may be splitting but I drove in that lane for about 3 miles before it ...
Full Review",David Noel,Rated 2 stars out of five stars,
21-Jul-18,Worked well until recently it keeps loosing my location. Looks like I'm driving through a field away from the road. Not good as I often work in new locations and I rely on it to get me to and from work safely,jiggs 1981,Rated 1 stars out of five stars,
23-Jul-18,"This is a disgusting app which opens my gps silently in the middle of the night and drains battery absolutely without permission, even when location permission was disabled completely.",A Google user,Rated 1 stars out of five stars,
28-Jul-18,Love but wish when in just driving mode i keeps the destination stuff on the screen wish when in just driving it would be just the map till i tap the screen. Please fix it used to work lile that now it dont.,William Parkison,Rated 3 stars out of five stars,1
23-Jul-18,"Doesn't show enough options that combine on and off highways. Too hard to turn off and on Avoid Highways when you're driving. Traffic (green, red etc.) shuts off and it's impossible to figure out how to turn it back on - very user unfriendly. Have to hit Directions every time.",Karen Brenner,Rated 3 stars out of five stars,
22-Jul-18,"Saved places with labels not shown in the list by label's name. All list showed as list with a lot of ""dropped pin"" records, without any labels. This is very terrible, a lot of waste of time!!! PLEASE FIX IT ASAP, YOU MAKE USERS CRAZY BY THAT F*KING BUG!",Teymur I.S.,Rated 3 stars out of five stars,
23-Jul-18,"Everything is good except showing directions...which makes it worst, dangrous and irritating. It shows opposite directions of destinatiom.",saurabh kumar,Rated 1 stars out of five stars,1
30-Jul-18,This app has gone downhill for the last 3 months and I can never get a solid point of directions anymore I'm changing apps this app sucks,Michael Hukill,Rated 1 stars out of five stars,
