Date,Reviews,Username,Stars,Helpful
18-Jul-18,"I use to love Google maps. It would take me everywhere I need to go. Now it's not giving good direction. Quite a few times the road ends. But it tells me to continue straight for the next 14 miles. It's not giving good good directions. It brings you in a big circle to where you should have turne...
Full Review",Christy Luberts,Rated 2 stars out of five stars,
18-Jul-18,All of a sudden I'm getting some weird times for routes an example an hour and 59 minutes to go 21 miles... Also the best route that you advised is generally the shortest but it takes the longest lot of turns and back streets,Rex Weaver,Rated 1 stars out of five stars,
16-Jul-18,"Can you guys please please add a feature to give real time reports while driving? Like the 'Waze'app does ? Like police reported ahead, car stopped on the shoulder, debris on the road.. like that. That'll be a great improvement. Thanks",Akshay Gedam,Rated 4 stars out of five stars,
17-Jul-18,"Absolute garbage since the last update. Keeps adding completely random routes, as well as 10 minutes extra travel time to the same route that I take every day. Also it screws up distances by several miles and adds about 15 minutes to known estimated travel times for zero reason.",greg williams,Rated 2 stars out of five stars,
11-Jul-18,"Active routing is useless. Cost me so much time, keeps telling me to get on and off the freeway 20+ miles from my stop. The app only works if you use it like a paper map and plan your own route.",Blake Hobba,Rated 1 stars out of five stars,
8-Jul-18,"I run delivery for work, and maps is fairly lackluster. I've ended up driving past my destination regularly as I'm told my destination is on the right. The routing sometimes makes no sense and if I chose to take a different route, maps will try to take me back to the nonsensical route. I'm using...
Full Review",Zane Lundgren,Rated 1 stars out of five stars,
16-Jul-18,Don't simply trust the app. You need a hospital and it will lead you to an open field. You select a specific destination and you'll find yourself you have travelled in the opposite direction. Not updated we current one directions either. Nefarious,Leonardo Passini,Rated 1 stars out of five stars,
16-Jul-18,"again sane problem after update..please google fix this.....Not showing Navigation arrow... showing circle for navigation....so it's difficult to follow the route during driving.. difficult to find route with the help of blue dot... please update arrow for directions...why my maps not showing ar...
Full Review",Vishwajit Lokhande,Rated 4 stars out of five stars,
18-Jul-18,"Despite update, changing address and deleting 6 months of data, this stupid app is still popping up every morning to direct me to an old address. Talk about a stupidly obvious glitch. Fix your app. I guess I'll use and recommend Waze in the meantime.",A Google user,Rated 2 stars out of five stars,
14-Jul-18,"Stupidest app ever!!! Cancels the journey if you turn GPS off. Stupid stupid. What happens if your battery is dieing orit is accidentally turned off!!? Good luck getting around in a foreign speaking country especially if you're lost!! Stupid. Might as well use citymapper as it's more accurate an...
Full Review",Winson Wong,Rated 1 stars out of five stars,
11-Jul-18,"This app used to be great up until the Android update about a week ago. Now, it is horrible. It is almost impossible to exit out of this app. For some reason, when I click the dual window button then all it does is shrink and there is no way to close it at all. Maybe it's just the update, but th...
Full Review",Cristian Canelas,Rated 2 stars out of five stars,
22-Jul-18,"I like the app just fine, but frequent bug fixes? How about the developers put together a well functioning app at the outset? Releasing buggy code is a poor idea. Now, if it's really about feature updates, just say so and let us know what you did.",Doug Powell,Rated 4 stars out of five stars,
10-Jul-18,"New update make the app less user friendly. App expands area on a search after I intentionally foccussed on a specific area, that banner""search this area"" pops up and will not go away, and business name are not showing up when zoomed in on. Google is missing the mark with their customer base more...
Full Review",A Google user,Rated 2 stars out of five stars,
16-Jul-18,"Showing wrong commute data lately. Also every time I'm in the middle of my commute and open the maps to check my progress, it will reset the maps to where i begun and not where I am hence having to move maps again and again",Saksham Shridhar,Rated 3 stars out of five stars,6
13-Jul-18,"It stopped working on my tablet. Reinstalled but still doesn't work. Okay on my phone and laptop. Very disappointed. Updated It arbitrarily stops working on my tablet. I was able to get it to work by answering ""yes"" to one question after reinstalling. Once again...it stopped working. I'll uninst...
Full Review",Teri Lafferty,Rated 1 stars out of five stars,
12-Jul-18,Worked pretty well but it told me to drive straight into a lake. The car was a rental because I recently ran over an employee and her head dented my hood. No I did not get the rental insurance.,Adrian Torres,Rated 5 stars out of five stars,
23-Jul-18,"Are you *trying* to get me to uninstall Google maps? I'm a truck driver. Stop erasing my recent history. Stop ""suggesting"" where I should go, unless you want me to suggest where you should go. Stop interfering with my route planning. Stop wasting my time. ""New features"" are not helping.",Penny Wayne,Rated 1 stars out of five stars,
13-Jul-18,"By far the most resource intensive app I've ever seen, rendering the app (and my phone when trying to use it) virtually unusable and causing crashes. Good luck getting the directions you need in time to actually use them if you need directions quickly.",Greg Ellinger,Rated 1 stars out of five stars,
14-Jul-18,"Recently it stopped working. When I nevigate and put the destination it shows ETA to reach and traffic conditions, however its not moving along with me and stays at the same point where I started navigation. Its total failure. I'm new to the city and I'm completely reliable on Google maps. Pleas...
Full Review",Sagar Kapse,Rated 1 stars out of five stars,
11-Jul-18,"Was perfect... but a few months ago a update started causing the app to minimize randomly. When I'm in the process of using the app I want it to be a full screen while I'm driving, taking the time to remaximize the app takes my eyes off the road and it's really annoying. I cant find a setting to...
Full Review",austin jerome,Rated 3 stars out of five stars,
13-Jul-18,This ap is basically useless now. It's so busy being an advertisment for every restaurant in town and data mining that it can't even pinpoint me anymore to give proper directions.,Craig Piagari,Rated 1 stars out of five stars,
12-Jul-18,"Even with the updated versions and a brand new Blackberry Keyone phone, the Google Maps always freezes and shuts down. Believe when I say it is not my phone but only my Google Maps App causing my phone to slow down and freeze. It's extremely upsetting and causes me a lot of stress especially when...
Full Review",A Google user,Rated 2 stars out of five stars,
16-Jul-18,"Google Maps used to be great. Now not so much. It takes me for unnecessary loops and doesn't go the feasible way. I'm a little disappointed, but still believe in its mapping capabilities.",Pamela Kanu,Rated 3 stars out of five stars,
13-Jul-18,I have a complaint and mailed for Google's help long before but no use. My service is not working in mobile network. The only WiFi option is also turned off but still it's not working. Kindly look into,Rakesh Raky,Rated 1 stars out of five stars,
12-Jul-18,"I updated the app today and it now, it's SUPER slow when it comes to loading and getting navigation instructions!! I've been trying to get directions for the last 5 minutes and it's still ""Trying to Find best Route"".",A Google user,Rated 1 stars out of five stars,
20-Jul-18,"Night mode has a horrible interface with all the traffic lines, it's difficult to spot the actual suggested path to destination. Wasn't any need whatsoever to make the night mode be dark themed The arrow supposed to show the direction you are in is completely wrong",vinit paul,Rated 1 stars out of five stars,
19-Jul-18,This app is getting worst. Whenever i search any location. It shows correct address but when i reach the destination i found this is not the right destination i want to visit. For example i search block E sector 4 and it eill drop at Block M sector 3.,naveen gupta,Rated 1 stars out of five stars,
13-Jul-18,"Since Samsung did an update a couple weeks ago, Google maps have not been able find my location. Always states gps signal lost and it has me placed in a different state. Haven't been able to use the app.",lyanna torres,Rated 2 stars out of five stars,
18-Jul-18,"Google: fix your unbelievably terrible navigation within the District of Columbia. It's like you are trying to get me lost in traffic circles and weird Highway entrances. I am uninstalling your terrible app and replacing it with literally anything, including a bird trained to fly above my car an...
Full Review",Lily Pastor,Rated 1 stars out of five stars,
15-Jul-18,"Mostly great. 2 issues: 1. ""Okay"" gets annoying rather fast. 2. When using android auto and having 2 similar routes. After chosing the non-default one when you turn off the car and turn it on again, the choice of the particular path is not remembered. Only the target is. I wanted to see a couple...
Full Review",Krzysztof Korz,Rated 4 stars out of five stars,
17-Jul-18,"While the app gives generally good directions and has good maps and access to satellite and street views, it is also buggy. It crashes often and regularly. Most often it crashes when I start a trip, but it really can shut down at any moment, while doing most anything. Sometimes it will crash jus...
Full Review",Paul Lenig,Rated 3 stars out of five stars,
17-Jul-18,"It will never load. I open the app and try to click on the buttons in the app and it doesnt even recognize me touching the screen. Its like it freezes. I just updated the app and it still does the same thing. It is so aggravating and it has been like this for months. I was hoping the update woul...
Full Review",Rachael Fugate,Rated 1 stars out of five stars,
15-Jul-18,"I have been using Google apps a lot as a big fan. But I have to mention this big issue on Google maps that it is often blank when travelling and using offline maps with no internet connection. It makes me get stuck and lost. Hope to let developers see this comment and fix this problem as soon as...
Full Review",Kyo-Min Jung,Rated 1 stars out of five stars,
16-Jul-18,"Very helpful app to find location and routs. I would like to suggest, to add following one more option to the Google Maps. Sometimes you are passing from dark area in the night time and did not see speed breaker that will be problem if you jump the car on speed breaker without noticing. If I am dr...
Full Review",Syed Abdul Shakoor Qadri - Omer,Rated 5 stars out of five stars,
4-Aug-18,"This app keeps giving me unwanted notifications. They make it so hard to disable them. I run my phone on do not disturb mode. I've tried blocking it, its a really annoying.",Zachary Johns,Rated 1 stars out of five stars,
13-Jul-18,"I am starting to get back liking google maps after many updates to improve the system like offline maps, re-routing, keeping my preferences to avoid tolls! Tolls is a big one for me. Only thing is it is a little buggy when I am typing in something. It lags from when I start typing to when whateve...
Full Review",C Williams,Rated 4 stars out of five stars,
10-Jul-18,This app has steadily gone downhill since the last few updates. Its constantly dropping signal for no apparent reason and doesnt give voice direction half the time. It used to be so much better.,Adrienne Werner,Rated 1 stars out of five stars,
18-Jul-18,"I liked this app a lot but recently it stopped speaking the directions. What's the point of it, then? I don't have a habit of staring at my phone while I drive. I'll use my trusty Garmin for driving directions & this app only for maps or when I need to locate something in particular. 1/2 useless ...
Full Review",Rosa Gamez,Rated 2 stars out of five stars,
13-Jul-18,"Good for live traffic and mostly accurate maps, but it does keep directing me down a bus-only road. There's a new, fundamental, flaw though. On two occasions within the last week it has changed my destination while I've been driving! The second case seemed to be based on a Google suggestion to s...
Full Review",Adam Richardson,Rated 2 stars out of five stars,
10-Jul-18,"There are more and more toll roads these days. Many people either never use the toll road or always use toll roads. Right now the default is to always use toll roads and every time I have to switch the hard to find check box to avoid toll roads. It can not be hard for Google to give me the option...
Full Review",Bob Modaress,Rated 1 stars out of five stars,
18-Jul-18,"Terrible! Google maps used to be accurate, now it doesn't even announce turns or exits until you on on top or past it. Several times it took me to a random destination in indinapolis that I didn't select and was way out of the route I needed to be on. I will never use this app again.",Healthy Chick,Rated 1 stars out of five stars,
19-Jul-18,"What have you done to this poor innocent app? Was 5 stars. Crashes, freezes my phone when toggling screens, weird glitch when switching back. Usually locks up before crucial turn. I hate picture in picture feature, can I toggle that off? Id like to be in charge of what I'm looking at, thanks.",Anthony Feig,Rated 1 stars out of five stars,
10-Jul-18,"I've used this app for years from Florida to Hawaii to Nova Scotia with excellent results. I even use it locally to check traffic. Sure, there have been a couple of glitches, but they're few and far between.",Frank Bainbridge,Rated 5 stars out of five stars,
22-Jul-18,UI updates get worse every time a new one comes out. Counter intuitive interactions and trying to cram too much into one view. Stop doing updates for the sake of updating..,Greg Smith,Rated 1 stars out of five stars,
19-Jul-18,"Functionality and map accuracy have been deteriorating for years. Its not really useful anymore. They seem focused on adding features, to the point that they ignore the basics. Recently maps has started to cause chrome to crash repeadedly (5 times last trip) even if i don't start chrome.",Peter Greening,Rated 1 stars out of five stars,
15-Jul-18,"At some point in recent history, you had detour functionality. Where did it go? You led me down a road that ended up being closed and I had no way to tell the app to find an alternate route... Had to retrace my path and take a guess, and missed an appointment as a result.",A Google user,Rated 3 stars out of five stars,
12-Jul-18,"Navigation is good, especially with lane specification. However, using Google Assistant to look up places while navigating automatically adds it to your route. You have to click to cancel, which distracts from driving. I had an additional stop added to my commute on accident, making me late. It'...
Full Review",Chistopher Tan,Rated 3 stars out of five stars,
14-Jul-18,"I am a heavy user of this app. When I still used Samsung Note5, it works brilliantly. Now, I upgraded to Samsung Note8. Ever since I change phone, the app works horribly especially the navigation function. It keeps showing 'searching for gps' whenever I start the navigation. Location setting is ...
Full Review",Kharisma Putra Kartono,Rated 2 stars out of five stars,
11-Jul-18,"Not proper and accurate every time. Sometimes it take person on that places where there is no CAR route. Two lane roads not shows as shortcut route while we find directions for any place. When we going on the route which shows in the map for directions to a place and unfortunately, if the route ...
Full Review",A Google user,Rated 3 stars out of five stars,
20-Jul-18,"Changes your route on the fly, even after selecting a route manually. The routes often don't make sense, has driven me around in circles a few times, after the last update it's always on mute and will not read directions even after i manually turn the sound to max. Worse with every update...",Mike Char,Rated 1 stars out of five stars,
14-Jul-18,The new update is terrible and I cant close out of the app. The screen freezes and I have to use Bixby to voice command it to close the damn app. Worked great before and now I'm forced to download another app I guess.,guitarrocka88,Rated 1 stars out of five stars,
19-Jul-18,"Please add a feature to this app that enables a chime/bell before every voice turn directions. I want to know a direction is coming up and a chime will prompt me to listen. After a long trip on the freeway, it may be too noisy in the car to hear the voice and the turn will be missed. A chime or ...
Full Review",A Google user,Rated 4 stars out of five stars,
17-Jul-18,"Doesn't passively show everything in an area, if you don't know the business is there, google may hide it. I've had to specifically search names of places for them to show up. Not good for seeing what's really around you",Null Field,Rated 2 stars out of five stars,
13-Jul-18,"Apparently it updated while I slept, all the spots that were pinned on my map as places I want to go, favorites and so on, have disappeared! Yes, I can go into a menu and find a List of these places, but even then they don't show on my map. What the heck?! I just want to see all my stuff at once...
Full Review",Kimberly Jones,Rated 3 stars out of five stars,
17-Jul-18,"Newest version has a debilitating bug which locks the UI so you can't close it. If in fullscreen navigation mode, it even blocks the ability to push the home button or back button or recent apps button. Only way to resolve is to restart phone.",Ben Nguyen,Rated 1 stars out of five stars,2
13-Jul-18,"One thing I never need to hear from the navigation voice is ""OK"". It's annoying and not necessary. It's not my pretend buddy, I'm not having a conversation with it, and I don't need that humanized touch to the voice. Just give me the damn directions and stop annoying me. Also why does the map mi...
Full Review",Bill Schneider,Rated 1 stars out of five stars,
17-Jul-18,"Voice navigation sometimes doesn't talk when it's time to take a turn. Been happening these past few days, please fix it! EDIT: Happened again, got stuck on a 13 minutes traffic jam. FFS PLEASE FIX THIS ISSUE IMMEDIATELY!",Rangga Wiratno,Rated 1 stars out of five stars,
9-Jul-18,"Was fine until most recent update. Now, you'll approach fork in road or exit and you'll hear nothing until you make wrong choice. Then you'll hear, ""OK, do XYZ."" Why aren't all route directions provided in advance??",Gina Serino,Rated 1 stars out of five stars,
18-Jul-18,"I used to love this app. I have some locations saved on it and use it every day. But the lag is so bad, even when I clear the history and such, that I'm probably going to switch to a different app now. When I try to search for a location or get directions it takes at least 10 min for everything t...
Full Review",Tessa Riley,Rated 2 stars out of five stars,
17-Jul-18,There is always an issue with recentering your pin location. The map doesn't changes with the pointer during a journey at getting directions. It used to be good but it sucks now. Google administration seriously needs to take a deep look at it. Kindly improve your services.,Usman Nadeems Studio,Rated 1 stars out of five stars,1
13-Jul-18,New version is slow. Info about pin cannot be dismissed without removing the pin (info takes up too much screen),Cristian Palasanu,Rated 2 stars out of five stars,
10-Jul-18,I work as delivery as well. This app malfunction all the time. It keeps on sending me to the wrong areas... makes me join m5 and m25 motorways (which are hard to come out of) for no reason at all. The other day it took me outside of london.,A Google user,Rated 1 stars out of five stars,
16-Jul-18,"The offline map is very restricted. It cannot change route and always wants to take toll roads. The routing also doesn't auto adjust when started from offline to online making it want to use toll even then. It also takes a long time to connect online for some reason. The app doesn't have app doe...
Full Review",Justin Li,Rated 1 stars out of five stars,
19-Jul-18,"I have no idea what has happened to this app but it takes you around the block unnecessarily. Never shows the direct easiest route. I don't have time for a scenic route . And lately starts the route blocks away from where the vehicle is parked despite choosing the from ""my location"". I also hate...
Full Review",Hilary Hargreaves,Rated 1 stars out of five stars,
16-Jul-18,"Since Android 8 you're bothering me with ""Maps is having trouble with Google Play services"" EVERY TIME you give me direction during navigation. It's so irritating, I'm uninstalling Maps until it's fixed. And NO, I won't give you all the permissions you're asking me for.",Grako VR Games & Music,Rated 1 stars out of five stars,
21-Jul-18,"Why is it worse at tracking buses and calculating niche routes than the ""Transit"" app? And why doesn't it do little audio/vibration notifications for bus stops? Cmon Google, you're better than this",Luke Warren,Rated 2 stars out of five stars,
13-Jul-18,"Love the app. I rarely have any issues with it. I wish we could turn on notifications of local speed limits when you're using GPS, unless you already can and I just don't know how to do it.",Kirsten Murphy,Rated 5 stars out of five stars,
11-Jul-18,App now drains my battery faster then I can charge. Have ample charger but app has massive drain even in background. Be sure to app kill and force close.,Shoog82,Rated 2 stars out of five stars,
27-Jul-18,"A very bad and disturbing app. Google products always consumes memory behind making my phone to lag while playing Arena of Valor, which is totally bad Google. Making me less contributing to my team and losing. Most of your apps are like this. Curse is the best solution.",rajasiva hika,Rated 1 stars out of five stars,
18-Jul-18,"I hate how I keep turning off the traffic layer and it keeps coming back Everytime I open the app. I absolutely loved the new botches of ads that now cover the screen when I search for something, that I removed a star from my review! Whoohoo for ads! Give us more ads please, like start showing u...
Full Review",yousef dash,Rated 2 stars out of five stars,
9-Jul-18,"Awesome!!! Don't add too much to a great app & bloat it...driving mode works very well. Not good in gallery mode, constantly swapping orientation at each junction/sideroad very poor & distracting. Great to just explore in maps too",Sammy Blish,Rated 5 stars out of five stars,
19-Jul-18,Google has turned this into insufferable bloatware. On a brand-new Android phone it takes forever to launch and to search even on extremely fast wifi (over 300Mbps).,Dr. Lefty Rogers,Rated 1 stars out of five stars,
16-Jul-18,"One thing this app needs, and I cannot stress that word enough, needs is a ""avoid toll roads"" feature. Took a four hundred mile trip and spent an extra $6.00 I could have used elsewhere if I could have just taken a alternate route. It is not the money, odds are I would have spent $6.00 on gasoli...
Full Review",John Becker,Rated 4 stars out of five stars,
17-Jul-18,"Terrible. Never works, loses signal and searches minutes into driving. This is Years of dealing with its poor navigation! Great at giving a map but never do i easily get to where i want to go when i follow navigation!",Mannyp Plesa,Rated 1 stars out of five stars,
19-Jul-18,"Traffic info does not appear The traffic info doesn't always shows on the map. Sometimes it appears & sometimes it doesn't. Whenever I zoom in or zoom out the traffic data disappears. Even when data is on & signal strength appears as 4G. I have to switch on & off the data, close the app several ...
Full Review",kam ash,Rated 2 stars out of five stars,
17-Jul-18,"Really good app that is always up to date, my only issue is that the app is always approximately 300m behind my current location. Very bad when travelling through major cities and you miss turns because of this",Jonathan Haigh,Rated 3 stars out of five stars,1
10-Jul-18,Mass transit WAY off course! I've consistently missed trains due to it inaccurately scheduling ride times off of DELAYED schedules that weren't even close to being delayed! Consistently missing hourly trains is so FRUSTRATING and affects my job status a ton!,Paper Bag,Rated 1 stars out of five stars,
16-Jul-18,"Ever since the most recent update, when I look for my destination - it comes up with a red triangle with an explanation sign saying, ""Can't find a way there."" I shouldn't have to uninstall and reinstall. I turned off my phone and it worked after, but it is even lacking on touch sensitivity while...
Full Review",Sarah Michelle,Rated 3 stars out of five stars,
11-Jul-18,Recently maps orientiation does not sit right. In my phone the map sits inverted so becomes difficult while driving. But the turning sign at top are good,P K,Rated 3 stars out of five stars,
11-Jul-18,"I love the app, it gets me to where I need to go, however there is an option on IOS that isn't on Android, and it's very frustrating. I'd like the ability to play the directions over Bluetooth Phone call. The only way I can hear the directions through my vehicle, is to have it on Bluetooth, which ...
Full Review",Margaret Wiltshire,Rated 4 stars out of five stars,
